{
  "schema_version": "consent-revocation-gate-v0",
  "status": "draft_scaffold",
  "gate_id": "PR-003",
  "enablement": {
    "trusted_completion_enabled": false,
    "team_sharing_enabled": false,
    "public_publication_enabled": false,
    "terminal_publication_completion_enabled": false
  },
  "surfaces": [
    {
      "surface_type": "private_candidate_collection_consent",
      "canonical_scope": "private_candidate_collection",
      "status": "disabled",
      "completion_transport": "none",
      "requires_step_up": true,
      "requires_comprehension_gate": true
    },
    {
      "surface_type": "private_retention_consent",
      "canonical_scope": "private_retention",
      "status": "handoff_only",
      "completion_transport": "none",
      "requires_step_up": true,
      "requires_comprehension_gate": true
    },
    {
      "surface_type": "team_namespace_grant_consent",
      "canonical_scope": "team_namespace_grant",
      "status": "disabled",
      "completion_transport": "none",
      "requires_step_up": true,
      "requires_comprehension_gate": true
    },
    {
      "surface_type": "public_publication_consent",
      "canonical_scope": "public_publication",
      "status": "disabled",
      "completion_transport": "none",
      "requires_step_up": true,
      "requires_comprehension_gate": true
    },
    {
      "surface_type": "intake_review_escrow_consent",
      "canonical_scope": "intake_review_escrow",
      "status": "disabled",
      "completion_transport": "none",
      "requires_step_up": true,
      "requires_comprehension_gate": true
    }
  ],
  "challenge_controls": {
    "single_use": true,
    "digest_bound": true,
    "expiry_bound": true,
    "csrf_state_bound": true,
    "frame_ancestor_protected": true,
    "exact_origin_redirect": true,
    "anti_enumeration_failures": true
  },
  "agent_boundaries": {
    "cli_mcp_can_create_handoff": true,
    "cli_mcp_can_complete_private_retention": false,
    "cli_mcp_can_complete_team_grant": false,
    "cli_mcp_can_complete_publication": false,
    "workers_can_complete_consent": false
  },
  "blocked_until": [
    "trusted_ui_implemented",
    "accessibility_baseline_pass",
    "challenge_completion_schemas_accepted",
    "csrf_and_clickjacking_tests_pass",
    "exact_origin_redirect_tests_pass",
    "anti_enumeration_tests_pass",
    "serializable_consent_tombstone_audit_tests_pass",
    "malicious_client_handoff_tests_pass"
  ]
}
